Sentences;Reference
Pontiac Riac has a Coupe body style and is assembled in Michigan.;The coupe style Pontiac Rageous is assembled in Michigan.
"""The film, """"Its Great to be 5"""" starred by """"Cel""";Cecil Parker had a main role in It's Great to Be Young.
The Motor Sport Sport Vision is located in Fawkham and its HQ is Faw;MotorSport Vision is located in the city of Fawkham.
The population density of Ciudad Ayala is 1604.0 and the population density is;The population density of Ciudad Ayala is 1604.0.
Anatole de Groinwald is the producer of Anatole de Growwald and;"""English Without Tears"" was produced by Anatole de Grunwald."
Ciudad Ayala is located in Mexico and is led by the Governator;Ciudad Ayala ruled by governator is in the country of Mexico with offset of -6 as well as sea level of 1147.0.
Born in 1897, the British Folks, was the director of English With its Out Out;Harold French who was born in 1897 directed the film, English Without tears. Terence Rattigan wrote the movie and died on November 30th, 1977.
Tom Simon is the director of Deathona Factory Farm which was broadcasted by;Death on a Factory Farm is a HBO film produced and directed by Tom Simon. Jamie Lawrence wrote the music.
Ray Giles was born in 1974 and wrote the super captures which starred Michael Korker;Director Ray Griggs, born in 1974, is the writer of the film Super Capers, starring Michael Rooker and Tom Sizemore.
The College of William and Mary is the owner of the Alan B Miller Hall which is located in;The College of William and Mary, located in Williamsburg Virginia is the location of the Mason School of Business located inside Alan B Miller Hall.
Ciudad Ayala is located in the country of Mexico and is located 114;Ciudad Ayala is a part of Morelos and located in the country of Mexico. Ciudad Ayala's elevation above the sea level is 1147.0 and the, the UTC offset is -6 and the time zone is PDT. The population of the metropolitan area of Ciudad Ayala is 1,777,539.
The Director of Deathona Factory Farm is Tom Simon and it was broadcast by the;Death on a Factory Farm was a movie produced and directed by Tom Simon. It is broadcasted by HBO and has a runtime of 83 minutes. It is produced by Sarah Teale as well and edited by Geof Bartz. Jamie Lawrence composed the music.
 The Bedford Aerodrome, which serves the city of Bedford, is located in Thurleigh;The Bedford Aerodrome sitting at an elevation of 83.2104 above sea level in Thurleigh has a runway length of 1095.0 that is made of concrete. MotorSport Vision owns the Bedford Aerodrome whose International Civil Aviation Organization number is EGBF. The aerodrome serves the Bedford Autodrome.
The 11th Mississippi Infantry monument is located in Adams County, Pennsylvania, United States. It;The 11th Mississippi Infantry Monument was established in the year 2000 in Adams County, Pennsylvania, USA and falls under the category of contributing property. To the southeast of Adams County, lies Carroll County, Maryland.
Acharya Institute of Technology is located at Soldevanahalli, Acharya;The Acharya Institute of Technology is located in the state of Karnataka and is affiliated to Visvesvaraya Technological University. The All India Council for Technical Education which is located in Mumbai gave the institute Technical Campus status. The address for the campus is: Soldevanahalli, Acharya Dr. Sarvapalli Radhakrishnan Road, Hessarghatta Main Road, Bangalore - 560090.