better explanation of the requirement:;the sentence is grammatically correct;the sentence is sound / logically valid. There are no typos or mistakes. ;the sentence is given is relevant, so it would make sense in a sentence. Example: ‘blue car going’ or ‘there is a blue car there’;The sentence is a natural stated answer, it doesn't feel computerized;the answer could be grammatically correct but is also a naturally flowing sentence;the answer is clear and is not confusing;the sentence is not ambiguous (could mean more things than once);the answer is engaging (for instance in a conversation would ignite a conversation);no difficult jargon used ;
Likert-scale rating (agree -5, somewhat agree-4, neutral-3, somewhat disagree-2, disagree-1);grammar;sound;relevant;human;fluent;clarity;unambiguous;engaging;understandable;
;;;;;;;;;;
Chinabank is located in the Philippines and is the location of Chinabank.;1;1;1;1;1;1;1;1;3;1,222222222
"""The film, """"Its Great to be 5"""" starred by """"Cel""";1;1;1;1;1;1;1;1;3;1,222222222
"""08/26 is the runway name of the Bedford Aerodrome, which has the name""";1;1;1;1;1;1;1;1;3;1,222222222
"""The sister production of the HBO, which has a sister station called the Cinemax, is""";4;4;3;3;4;3;3;3;3;3,333333333
John Miller died in 2005 and he died in 2005.;5;3;2;2;2;2;2;2;3;2,555555556
;2,4;2;1,6;1,6;1,8;1,6;1,6;1,6;3;1,911111111
;;;;;;;;;;
Ciudad Ayala is located in Mexico and is led by the Governator;5;5;5;5;5;5;5;5;5;5
Bionico is a dessert dish from Mexico, where the currency is the peso;5;5;5;5;5;5;5;5;5;5
Aaron Turner started performing in 1995 and his musical career began in 1995. He plays Post-met;4;4;3;3;3;3;3;3;3;3,222222222
Ray Giles was born in 1974 and wrote the super captures which starred Michael Korker;4;3;4;4;4;4;4;4;4;3,888888889
Anatole de Growwald produces English Without Teas which is edited by Alan Ja;5;5;5;5;5;5;5;5;5;5
;4,6;4,4;4,4;4,4;4,4;4,4;4,4;4,4;4,4;4,422222222
;;;;;;;;;;
The city of Ciudad Ayala is led by the City Manager and is located;1;1;1;1;1;1;1;1;1;1
The director of It's Great Britain is Cyril Frankel and it stars John Miller;5;5;5;5;5;5;5;5;5;5
 The Bedford Aerodrome, which serves the city of Bedford, is located in Thurleigh;5;5;5;5;5;5;5;5;5;5
 The city of Ciudad Ayala in Mexico is led by the City Manager.;4;4;3;3;3;3;3;3;3;3,222222222
Ciudad Ayala is located in the city of Ciu in the Andlos;5;5;5;5;5;5;5;5;5;5
;4;4;3,8;3,8;3,8;3,8;3,8;3,8;3,8;3,844444444
;;;;;;;;;;
;3,666666667;3,466666667;3,266666667;3,266666667;3,333333333;3,266666667;3,266666667;3,266666667;3,733333333;
